Name,ID,Vicinity,latitude,longitude,Rating,Url
Vega City Mall Food Court,ChIJ-xKR7TgVrjsRI0viMM0nGUI,"WJ52+3FJ, Vega city,food court, Bannerghatta Main Rd, BTM Layout, Bengaluru",12.9077144,77.6011375,4.3,https://www.google.com/maps/place/?q=place_id:ChIJ-xKR7TgVrjsRI0viMM0nGUI
Orion Mall Food Court,ChIJAV62v3g9rjsRT7TFt6zi4Uk,"2H63+MXJ, Rajajinagar, Bengaluru",13.0117011,77.5548982,4.2,https://www.google.com/maps/place/?q=place_id:ChIJAV62v3g9rjsRT7TFt6zi4Uk
Brookefield mall foodcourt,ChIJddfIyJgTrjsRqvqhJOrQ4Hw,"24, ITPL Main Rd, AECS Layout, Marathahalli, Bengaluru",12.9660098,77.7179269,3.8,https://www.google.com/maps/place/?q=place_id:ChIJddfIyJgTrjsRqvqhJOrQ4Hw
By The Way Foodcourt,ChIJlZbc8pxsrjsReIPVE6jx_s8,"Ground Floor, Skyward TechPark, Velankani Drive, Electronics City Phase 1, Bengaluru",12.8481297,77.6576546,4,https://www.google.com/maps/place/?q=place_id:ChIJlZbc8pxsrjsReIPVE6jx_s8
Bagmane Tech Park Food Court,ChIJM4N1OFIRrjsRd4VkGHll9wA,"XMH5+R53, Krishnappa Garden, C V Raman Nagar, Bengaluru",12.9795154,77.6579104,4,https://www.google.com/maps/place/?q=place_id:ChIJM4N1OFIRrjsRd4VkGHll9wA
Forum Value Mall Food Court,ChIJ5XidcpcNrjsRZbI0rrKZnM4,"XP5X+R3G, Prestige Ozone, Whitefield, Bengaluru",12.9595657,77.7477128,4.1,https://www.google.com/maps/place/?q=place_id:ChIJ5XidcpcNrjsRZbI0rrKZnM4
Food Court,ChIJHU6XH08ZrjsRwQ-2fDlBHms,"3HVV+JXP, RMZ Galleria, Yelahanka, Bengaluru",13.0940886,77.5949476,4,https://www.google.com/maps/place/?q=place_id:ChIJHU6XH08ZrjsRwQ-2fDlBHms
Food Court,ChIJpxGzCEcVrjsRHeY2hyRzJnE,"WJ8Q+F6P, Service Rd, Teacher's Colony, 1st Sector, Koramangala, Bengaluru",12.9161982,77.6380857,3,https://www.google.com/maps/place/?q=place_id:ChIJpxGzCEcVrjsRHeY2hyRzJnE
The Food Plaza,ChIJzXgoKvIVrjsRyYorvWE76c8,"VJXM+9FX, Service Rd, Hongasandra, Bengaluru",12.8984824,77.6337339,3.9,https://www.google.com/maps/place/?q=place_id:ChIJzXgoKvIVrjsRyYorvWE76c8
Food Court,ChIJQWduNQkVrjsR9YB7OMtU1jM,"45/2, Marenahalli Rd, KSRTC Layout, 2nd Phase, J. P. Nagar, Bengaluru",12.9164125,77.5921916,3.8,https://www.google.com/maps/place/?q=place_id:ChIJQWduNQkVrjsR9YB7OMtU1jM
Onyx Food Court,ChIJ1fzLx3ARrjsRGplrqC6K8s8,"XMPV+9PW, Bagmane World Technology Center, Bengaluru",12.9859825,77.6943379,3.8,https://www.google.com/maps/place/?q=place_id:ChIJ1fzLx3ARrjsRGplrqC6K8s8
Food Court,ChIJjWwhPLEPrjsRI_11nTVV4rM,"XQM8+6R9, Channasandra, Bengaluru",12.9830398,77.7671093,4.3,https://www.google.com/maps/place/?q=place_id:ChIJjWwhPLEPrjsRI_11nTVV4rM
Food Court,ChIJtSEL5GM9rjsRHZ6nROrY0w8,"387, 57th Cross Rd, 1st Block, 3rd Block, Rajajinagar, Bengaluru",12.9855962,77.5544081,5,https://www.google.com/maps/place/?q=place_id:ChIJtSEL5GM9rjsRHZ6nROrY0w8
Pritech Park Food Court,ChIJczArjQsTrjsR2GbrAg1YlzI,"WMCJ+HF2, Pritech Rd, Adarsh Palm Retreat, Bellandur, Bengaluru",12.9211868,77.6811331,3.9,https://www.google.com/maps/place/?q=place_id:ChIJczArjQsTrjsR2GbrAg1YlzI
Foods Court: A Multi Brand Cafe,ChIJg10whFQTrjsR65lHdzhesnA,"BBMP East, foods@court No 161/1, basement shop sathvik tower, Basavanagar Main Rd, Ramaiahreddy Colony, mahadevapura, Bengaluru",12.9701068,77.6822189,4.5,https://www.google.com/maps/place/?q=place_id:ChIJg10whFQTrjsR65lHdzhesnA
global mall food court,ChIJb1iBCLIXrjsRLrSfd680pxM,"XHJ7+C8M, Gopalapura, Binnipete, Bengaluru",12.981098,77.5632855,4,https://www.google.com/maps/place/?q=place_id:ChIJb1iBCLIXrjsRLrSfd680pxM
"Terminal Food Court, Infosys Limited",ChIJ-Wdd95BsrjsRT8uSc5o2qBM,"RMX8+QVH, Infosys Avenue, Electronics City Phase 1, Electronic City, Bengaluru",12.849448,77.6672279,4.2,https://www.google.com/maps/place/?q=place_id:ChIJ-Wdd95BsrjsRT8uSc5o2qBM
Sudarshan food court,ChIJkwR0JqYXrjsRTD3DsL6CK48,"7th cross, 32, post, Hanumanthappa Layout, RT Nagar, Bengaluru",13.0319541,77.6060439,3.3,https://www.google.com/maps/place/?q=place_id:ChIJkwR0JqYXrjsRTD3DsL6CK48
HOT BITE FOODCOURT,ChIJHXutws09rjsR5qwq5mZ6c54,"Shed no 3 near basaveshwara satellite bus stop Peenya plantation, Jalahalli West, Bengaluru",13.0449808,77.5253028,4,https://www.google.com/maps/place/?q=place_id:ChIJHXutws09rjsR5qwq5mZ6c54
Lotus Foodcourt - Shell 1,ChIJw1RNW5BsrjsR1Xcjub1oszs,"RMX8+CQ5, c/o, Infosys Avenue, Lotus Path, Electronics City Phase 1, Electronic City, Bengaluru",12.8485066,77.6669797,4,https://www.google.com/maps/place/?q=place_id:ChIJw1RNW5BsrjsR1Xcjub1oszs
Sri Srinivasa Food Court & Catering,ChIJpdgG1zURrjsR6HNqa-nZQI8,"Shop# 6 & 7, Shivaganga Complex, Shivaganga Layout, Dr Puneeth Rajkumar Rd, Mahadevapura, Bengaluru",12.9891752,77.6893487,4.5,https://www.google.com/maps/place/?q=place_id:ChIJpdgG1zURrjsR6HNqa-nZQI8
Anekal Food Court,ChIJUWZn44NvrjsR-C6FISUa3Tg,"STB complex, near Anekal court, Attibele main road, Anekal Town, Bengaluru",12.7124611,77.7021269,4.6,https://www.google.com/maps/place/?q=place_id:ChIJUWZn44NvrjsR-C6FISUa3Tg
Embassy P5 Food Court D Block,ChIJdZFaW_wTrjsRQSynGqfbwXY,"Food Court, BLOCK-D, Embassy Tech Village Rd, Devarabisanahalli, Bellandur, Bengaluru",12.9275049,77.6921886,4.8,https://www.google.com/maps/place/?q=place_id:ChIJdZFaW_wTrjsRQSynGqfbwXY
Karavali Food Court,ChIJocA_XBsVrjsRLtPdW9_tCnA,"Apartments, BDA 80 Feet Rd, opp. PARAMOUNT PILATUS, Vysya Bank Colony, Shantiniketan Layout, Arekere, Bengaluru",12.8833952,77.605054,5,https://www.google.com/maps/place/?q=place_id:ChIJocA_XBsVrjsRLtPdW9_tCnA
BIEC Food court,ChIJhVb9cp4jrjsRMwABm2GjfGY,"3F7G+356, Unnamed Road, Bengaluru",13.0626564,77.4755183,3.9,https://www.google.com/maps/place/?q=place_id:ChIJhVb9cp4jrjsRMwABm2GjfGY
Food court,ChIJ5csktSUVrjsR83ZpeyL7PsU,"BTM 2nd Stage, Kuvempu Nagar, BTM 2nd Stage, BTM Layout, Bengaluru",12.9148979,77.6126707,0,https://www.google.com/maps/place/?q=place_id:ChIJ5csktSUVrjsR83ZpeyL7PsU
food court,ChIJmxNRmSgVrjsRLhPCfHsIrjE,"Masjid St, Yellagondanpalya, Victoria Layout, Bengaluru",12.9624747,77.6125214,0,https://www.google.com/maps/place/?q=place_id:ChIJmxNRmSgVrjsRLhPCfHsIrjE
Food Court,ChIJWw284kEXrjsRl8Ub7IgJIXc,"No.117,22nd Cross, Cubbonpet Main Rd, Bengaluru",12.9744859,77.5785589,0,https://www.google.com/maps/place/?q=place_id:ChIJWw284kEXrjsRl8Ub7IgJIXc
ESC Food Court,ChIJHb9542QXrjsRciGLDiS9FUE,"3J2C+8JC, Manayata Tech Park, Thanisandra, Bengaluru",13.0510762,77.6215667,4,https://www.google.com/maps/place/?q=place_id:ChIJHb9542QXrjsRciGLDiS9FUE
Pyramid Food Court,ChIJIziDa5gVrjsR9wvxcodd-9Q,"PYRAMID FOOD COURT 1 AND 7/3, Embassy Golf Links Business Park, Domlur, Bengaluru",12.9491903,77.643499,4.1,https://www.google.com/maps/place/?q=place_id:ChIJIziDa5gVrjsR9wvxcodd-9Q
The Food Court,ChIJJUmceMEVrjsRHOuYGfYMQaA,"4th Cross, 4th Block, Green Leaf Extension, near Nasi and Mee, Koramangala",12.9353581,77.6295347,4.1,https://www.google.com/maps/place/?q=place_id:ChIJJUmceMEVrjsRHOuYGfYMQaA
NN FOOD COURT,ChIJ6QMjAocRrjsRowbJCYK_-j4,"Kodigehalli Main Rd, Ayyappa Nagar, Krishnarajapura, Bengaluru",13.0039805,77.7152624,3.6,https://www.google.com/maps/place/?q=place_id:ChIJ6QMjAocRrjsRowbJCYK_-j4
Modern Food Court,ChIJy7I0mT8ZrjsRW7ieplq2ykk,"No 1 Shivanahalli, Jakkur - Yelahanka Rd, Bengaluru",13.0899307,77.6028556,4.9,https://www.google.com/maps/place/?q=place_id:ChIJy7I0mT8ZrjsRW7ieplq2ykk
Hotel Food Court,ChIJRd0wC7gXrjsRjoBHIsEbVB8,"XHHC+8CF, Kempegowda, Majestic, Bengaluru",12.9783072,77.5710334,3,https://www.google.com/maps/place/?q=place_id:ChIJRd0wC7gXrjsRjoBHIsEbVB8
Food Court Veg&non Veg,ChIJEzWiJ7k-rjsRAoDkb34KzdY,"KPSC Layout Park, 20, Dodda Basti Main Rd, Bhuvaneshwari Nagar, Jnana Ganga Nagar, Bengaluru",12.9422988,77.4865377,4.2,https://www.google.com/maps/place/?q=place_id:ChIJEzWiJ7k-rjsRAoDkb34KzdY
Families Food Court,ChIJmb8n6KMUrjsR-c-5iaLZHE0,"36/6, Samasundra Palya ,2nd Sector, Bengaluru",12.9005997,77.6516747,4,https://www.google.com/maps/place/?q=place_id:ChIJmb8n6KMUrjsR-c-5iaLZHE0
Mumbai Food Court,ChIJP1WVxi8WrjsRiy1ZdS3l6gU,"133, 11th Cross Rd, Vyalikaval, Kodandarampura, Malleswaram, Bengaluru",13.0019402,77.5718469,4.1,https://www.google.com/maps/place/?q=place_id:ChIJP1WVxi8WrjsRiy1ZdS3l6gU
Monesha Food Court,ChIJYQmof2kVrjsRFbkZhNX26eA,"23rd Min 11 Cross, near Pickly Office, Bommanahalli, Bengaluru",12.9076719,77.6324524,0,https://www.google.com/maps/place/?q=place_id:ChIJYQmof2kVrjsRFbkZhNX26eA
royal food court,ChIJ1VWa2t0XrjsRvO8kaYkxArM,"33/1, 2nd Main Rd, opp. Old RTO, opp. Old RTO complex, Binnamangala, Stage 1, Indiranagar, Bengaluru",12.9823798,77.6377152,5,https://www.google.com/maps/place/?q=place_id:ChIJ1VWa2t0XrjsRvO8kaYkxArM
Bhaiyyaji Food Court,ChIJIwdZdIMWrjsR1nyE_QOLjYk,"1007, Mahatma Gandhi Rd, Yellappa Garden, Yellappa Chetty Layout, Sivanchetti Gardens, Bengaluru",12.974885,77.6145688,4,https://www.google.com/maps/place/?q=place_id:ChIJIwdZdIMWrjsR1nyE_QOLjYk
Royal Food court,ChIJlbEa62cdrjsRvhU7vEwmpYA,"Devanahalli High way, next to Srinidhi Vaibhav, Bengaluru",13.2437197,77.7172413,3.9,https://www.google.com/maps/place/?q=place_id:ChIJlbEa62cdrjsRvhU7vEwmpYA
Nanjundappa Food Court,ChIJbWfcoxgVrjsRbaWXexQl3QA,"136,23rd Main, 2nd Cross Rd, near MedPlus, Bommanahalli, Bengaluru",12.9073001,77.6326021,0,https://www.google.com/maps/place/?q=place_id:ChIJbWfcoxgVrjsRbaWXexQl3QA
Vinayak Food,ChIJoT_BCKE9rjsROiOv8jtmK0Q,"12, Sreenivas Nagar, Nandini Layout, Bengaluru",13.0145215,77.53096,0,https://www.google.com/maps/place/?q=place_id:ChIJoT_BCKE9rjsROiOv8jtmK0Q
Mangalore food court,ChIJEUjaIMdtrjsRaH-UVfFCw5E,"16, vikas nagarshopping complex yarandahalli, road, near State Bank Of India, Bommasandra Industrial Area, Bengaluru",12.8103059,77.6783747,4.8,https://www.google.com/maps/place/?q=place_id:ChIJEUjaIMdtrjsRaH-UVfFCw5E
Mahesh food court,ChIJY5mm9eYVrjsRjJ-ZhaQPOMM,"196, 9th Cross Rd, 2nd Block, Jaya Nagar East, Jayanagar, Bengaluru",12.9395791,77.5823004,4.5,https://www.google.com/maps/place/?q=place_id:ChIJY5mm9eYVrjsRjJ-ZhaQPOMM
HSR Food Street,ChIJQXj8RfIVrjsRRweOmp4xre8,"18th Cross Rd, 24th, Main Rd, Sector 7, HSR Layout, Bengaluru",12.910107,77.6380524,4.3,https://www.google.com/maps/place/?q=place_id:ChIJQXj8RfIVrjsRRweOmp4xre8
CAPSICUM FOOD COURT,ChIJyxLTgHwjrjsRMu7MzCWvIiQ,"3GF2+VRC, Acharya Dr Sarvepalli Radhakrishnan Rd, Thammenahalli Village, Bengaluru",13.0746664,77.5020031,5,https://www.google.com/maps/place/?q=place_id:ChIJyxLTgHwjrjsRMu7MzCWvIiQ
Sm food court,ChIJHVZHeZVrrjsRYlTldAp7LVg,"No 107/1, DODDATHOGURU, Electronic City, Bengaluru",12.8431953,77.6441407,4.7,https://www.google.com/maps/place/?q=place_id:ChIJHVZHeZVrrjsRYlTldAp7LVg
Food court,ChIJ8-GsMI5srjsR32klJor5yCw,"RMW9+3CV, 1st Main Rd, Electronics City Phase 1, Electronic City, Bengaluru",12.8452468,77.6686395,4.1,https://www.google.com/maps/place/?q=place_id:ChIJ8-GsMI5srjsR32klJor5yCw
IAF FOOD COURT,ChIJQco3iDwZrjsR91C278xgA0A,"4JJC+MR6, Kattigenahalli, Bengaluru",13.1316589,77.6220248,4.1,https://www.google.com/maps/place/?q=place_id:ChIJQco3iDwZrjsR91C278xgA0A
Food Court Building,ChIJ2b7YSFcjrjsRuI0RBcXvluI,"3F6G+R5C, Totadaguddadahalli",13.0620604,77.4753994,4,https://www.google.com/maps/place/?q=place_id:ChIJ2b7YSFcjrjsRuI0RBcXvluI
A1 Food Court,ChIJ1dyIbMsjrjsRCeYnhBmnhK4,"3FMP+MWH, Bengaluru",13.0841925,77.4875049,4.4,https://www.google.com/maps/place/?q=place_id:ChIJ1dyIbMsjrjsRCeYnhBmnhK4
Narayana Food Court,ChIJ5weqphkVrjsRwRjN3j6gpPM,"23rd Main, 7th cross, near Silkboard, Bommanahalli, Bengaluru",12.9167024,77.6235238,0,https://www.google.com/maps/place/?q=place_id:ChIJ5weqphkVrjsRwRjN3j6gpPM
Food Court,ChIJwSvuLmoXrjsRbAhlvkCYHEM,"2 1st Main, Challakere Main Road, Kalyan Nagar, Bengaluru",13.0274437,77.6434527,4,https://www.google.com/maps/place/?q=place_id:ChIJwSvuLmoXrjsRbAhlvkCYHEM
Food Court Shivakumar G,ChIJFVFNqhVbrjsRAPlZkwXqhJ4,"16, Kanakapura Rd, Bengaluru",12.6802256,77.4692502,0,https://www.google.com/maps/place/?q=place_id:ChIJFVFNqhVbrjsRAPlZkwXqhJ4
Kitchens@ Banashankari,ChIJB8I6EC4_rjsRP0tY9p4q988,"216, Dr Puneeth Rajkumar Rd, Ittamadu, Banashankari 3rd Stage, Banashankari, Bengaluru",12.9270225,77.547871,4.4,https://www.google.com/maps/place/?q=place_id:ChIJB8I6EC4_rjsRP0tY9p4q988
e2z Food Court,ChIJ4ewAMGYXrjsRBss3mnavOBw,"Manyata Embassy Business Park Parking, Manayata Tech Park, Nagavara, Bengaluru",13.0512583,77.6210636,2.5,https://www.google.com/maps/place/?q=place_id:ChIJ4ewAMGYXrjsRBss3mnavOBw
Raptharr Food Court,ChIJmeN67qYRrjsRO9hUCVmAYRo,"Site No 15,Ground Floor,Kumbena Agrahara Village,Bidrahalli, Hobli, Belathur, Bengaluru",13.0004101,77.7432949,4.9,https://www.google.com/maps/place/?q=place_id:ChIJmeN67qYRrjsRO9hUCVmAYRo
Sunil Food Court,ChIJs7WePaMVrjsRhiYsUh_avgk,"7th Main Rd, near Pickly Office, Sector 7, Bommanahalli, Bengaluru",12.9076086,77.6325364,0,https://www.google.com/maps/place/?q=place_id:ChIJs7WePaMVrjsRhiYsUh_avgk
3D Food Court,ChIJ_6HgHNMWrjsRyAqwWRpfdPs,"303, 4th Main Rd, OMBR Layout, Banaswadi, Bengaluru",13.0068695,77.6515397,3.3,https://www.google.com/maps/place/?q=place_id:ChIJ_6HgHNMWrjsRyAqwWRpfdPs
